{
  "paperId": "csir_net_general_aptitude_set_5",
  "title": "CSIR NET General Aptitude - Set 5",
  "subject": "General Aptitude (Part A)",
  "durationMinutes": 40,
  "totalQuestions": 20,
  "totalMarks": 40,
  "schedule": {
    "examDate": "2026-09-18",
    "startTime": "21:00",
    "resultDate": "2026-09-18",
    "resultTime": "21:40"
  },
  "markingScheme": {
    "positiveMarks": 2,
    "negativeMarks": 0.66
  },
  "questions": [
    {
      "id": 1,
      "type": "MCQ",
      "marks": 2,
      "negativeMarks": 0.66,
      "question": "A group of 540 persons is to be seated row wise such that the number of persons in each row is 4 less than in the previous row. Which of the following number of rows is not possible?",
      "options": [
        {
          "id": "a",
          "text": "5"
        },
        {
          "id": "b",
          "text": "6"
        },
        {
          "id": "c",
          "text": "8"
        },
        {
          "id": "d",
          "text": "9"
        }
      ],
      "correctAnswer": "c",
      "solution": "**Given:**\n- Total persons to be seated: $S_n = 540$\n- Persons in each subsequent row decrease by $4$, so common difference $d = -4$\n- Let $n$ be the number of rows, and $x$ be the number of persons in the first row ($a = x$)\n\n**Formula:**\nThe sum of an Arithmetic Progression (AP) is:\n$$S_n = \\frac{n}{2} [2a + (n - 1)d]$$\n\nSubstitute the given values:\n$$540 = \\frac{n}{2} [2x + (n - 1)(-4)]$$\n$$1080 = n [2x - 4n + 4] \\implies 2x - 4n + 4 = \\frac{1080}{n}$$\n$$2x = \\frac{1080}{n} + 4n - 4 \\implies x = \\frac{540}{n} + 2n - 2$$\n\nFor the seating arrangement to be valid, $x$ must be a positive integer.\n\n**Testing Each Option:**\n1. **For $n = 5$:**\n   $$x = \\frac{540}{5} + 2(5) - 2 = 108 + 10 - 2 = 116 \\quad (\\text{valid integer})$$\n2. **For $n = 6$:**\n   $$x = \\frac{540}{6} + 2(6) - 2 = 90 + 12 - 2 = 100 \\quad (\\text{valid integer})$$\n3. **For $n = 8$:**\n   $$x = \\frac{540}{8} + 2(8) - 2 = 67.5 + 16 - 2 = 81.5 \\quad (\\text{not an integer})$$\n   Since the number of persons in a row cannot be a fraction ($81.5$), $8$ rows is impossible.\n4. **For $n = 9$:**\n   $$x = \\frac{540}{9} + 2(9) - 2 = 60 + 18 - 2 = 76 \\quad (\\text{valid integer})$$\n\n**Final Answer:** (c) 8"
    },
    {
      "id": 2,
      "type": "MCQ",
      "marks": 2,
      "negativeMarks": 0.66,
      "question": "A ring is rolling along a straight track as shown. The topmost point of the ring is marked. Which of the diagrams shows a possible position of the ring at a later time, relative to the original position (shown by dashed circle)?",
      "diagramSvg": "<div style=\"display:flex;flex-direction:column;align-items:center;gap:12px;margin:12px 0;\"><img src=\"data/images/set5/q2_setup.png\" alt=\"Rolling ring initial position\" style=\"max-width:380px;width:100%;border-radius:4px;box-shadow:0 1px 3px rgba(0,0,0,0.1);\" /><img src=\"data/images/set5/q2_options.png\" alt=\"Rolling ring options A, B, C, D\" style=\"max-width:240px;width:100%;border-radius:4px;box-shadow:0 1px 3px rgba(0,0,0,0.1);\" /></div>",
      "options": [
        {
          "id": "a",
          "text": "A"
        },
        {
          "id": "b",
          "text": "B"
        },
        {
          "id": "c",
          "text": "C"
        },
        {
          "id": "d",
          "text": "D"
        }
      ],
      "correctAnswer": "b",
      "solution": "**Concept:**\nRolling without slipping consists of two simultaneous components:\n1. **Translational Motion:** The center of mass moves horizontally forward in a straight line: $x_{\\text{cm}} = R\\theta$.\n2. **Rotational Motion:** The ring rotates clockwise about its center with angular displacement $\\theta$.\n\n**Analysis of the Marked Point:**\n- Initially, the marked point is located at the top apex of the ring $(0, 2R)$.\n- As the ring rolls forward to the right along the track, the marked point rotates clockwise, moving **forward and downward** along a cycloidal trajectory:\n  $$x(\\theta) = R(\\theta + \\sin\\theta), \\quad y(\\theta) = R(1 + \\cos\\theta)$$\n- For an initial forward rotation ($0 < \\theta < \\pi$), the marked point must lie below the top and to the forward (right) side of the ring's center.\n- Diagram **B** correctly illustrates this position: the ring has rolled forward from the dashed outline, and the marked point has shifted forward and downward along the circumference.\n\n**Final Answer:** (b) B"
    },
    {
      "id": 3,
      "type": "MCQ",
      "marks": 2,
      "negativeMarks": 0.66,
      "question": "An experiment consists of tossing four fair coins independently. The outcome of the experiment is considered favourable, if the number of heads is greater than the number of tails. The probability of a favourable outcome from a single experiment is:",
      "options": [
        {
          "id": "a",
          "text": "$\\frac{1}{2}$"
        },
        {
          "id": "b",
          "text": "$\\frac{3}{16}$"
        },
        {
          "id": "c",
          "text": "$\\frac{5}{16}$"
        },
        {
          "id": "d",
          "text": "$\\frac{3}{4}$"
        }
      ],
      "correctAnswer": "c",
      "solution": "**Given:**\n- Number of independent fair coin tosses: $n = 4$\n- For each coin toss, $P(H) = P(T) = \\frac{1}{2}$\n\n**Step 1: Total Number of Outcomes:**\n$$\\text{Total outcomes} = 2^4 = 16$$\n\n**Step 2: Favourable Outcomes:**\nAn outcome is favourable if the number of heads $H$ is strictly greater than the number of tails $T$.\nSince $H + T = 4$:\n$$H > T \\implies H > 4 - H \\implies 2H > 4 \\implies H \\ge 3$$\nThus, favourable cases occur when $H = 3$ or $H = 4$:\n- **Case 1 (3 Heads, 1 Tail):** $\\binom{4}{3} = 4$ ways: $\\{\\text{HHHT, HHTH, HTHH, THHH}\\}$\n- **Case 2 (4 Heads, 0 Tails):** $\\binom{4}{4} = 1$ way: $\\{\\text{HHHH}\\}$\n\n$$\\text{Total favourable outcomes} = 4 + 1 = 5$$\n\n**Step 3: Probability Calculation:**\n$$P(\\text{Favourable}) = \\frac{\\text{Favourable outcomes}}{\\text{Total outcomes}} = \\mathbf{\\frac{5}{16}}$$\n\n**Final Answer:** (c) $\\frac{5}{16}$"
    },
    {
      "id": 4,
      "type": "MCQ",
      "marks": 2,
      "negativeMarks": 0.66,
      "question": "In a class, among the boys B is taller than 10 boys, but shorter than 13 others. Among girls, G is taller than 6 girls, but shorter than 8 others. Two boys and three girls are shorter than B, but taller than G. If no two persons have the same height, then in the entire class, B is:",
      "options": [
        {
          "id": "a",
          "text": "taller than 21, but shorter than 18 others"
        },
        {
          "id": "b",
          "text": "taller than 20, but shorter than 18 others"
        },
        {
          "id": "c",
          "text": "taller than 20, but shorter than 19 others"
        },
        {
          "id": "d",
          "text": "taller than 19, but shorter than 19 others"
        }
      ],
      "correctAnswer": "b",
      "solution": "**Step 1: Count total boys and girls in the class:**\n- Among boys: B is taller than 10 boys and shorter than 13 boys:\n  $$\\text{Total boys} = 10 + 1\\text{ (B)} + 13 = 24$$\n- Among girls: G is taller than 6 girls and shorter than 8 girls:\n  $$\\text{Total girls} = 6 + 1\\text{ (G)} + 8 = 15$$\n- Total students in class $= 24 + 15 = 39$.\n\n**Step 2: Determine students shorter than B:**\n- **Boys shorter than B:** Exactly $10$ boys.\n- **Girls shorter than B:**\n  - G is taller than $6$ girls (so these 6 girls are shorter than G).\n  - There are $3$ girls between G and B (shorter than B, but taller than G).\n  - G herself is shorter than B.\n  - Therefore, girls shorter than B $= 6 + 1\\text{ (G)} + 3 = 10$ girls.\n- Total students shorter than B $= 10\\text{ boys} + 10\\text{ girls} = \\mathbf{20\\text{ students}}$.\n\n**Step 3: Determine students taller than B:**\n- Total other students in the class $= 39 - 1\\text{ (B)} = 38$.\n- Students taller than B $= 38 - 20 = \\mathbf{18\\text{ others}}$.\n\nThus, B is **taller than 20, but shorter than 18 others**.\n\n**Final Answer:** (b) taller than 20, but shorter than 18 others"
    },
    {
      "id": 5,
      "type": "MCQ",
      "marks": 2,
      "negativeMarks": 0.66,
      "question": "On a one-way road, to demarcate 4 lanes, line segments of 3.5 m length are painted with gaps of 3.5 m along the length of the road. What is the total length of the painted lines (in m) over a 350 m stretch of the road?",
      "options": [
        {
          "id": "a",
          "text": "300"
        },
        {
          "id": "b",
          "text": "400"
        },
        {
          "id": "c",
          "text": "525"
        },
        {
          "id": "d",
          "text": "700"
        }
      ],
      "correctAnswer": "c",
      "solution": "**Step 1: Number of dividing lines:**\nTo demarcate $4$ lanes on a road, the number of dividing boundary lines required is:\n$$\\text{Number of divider lines} = 4 - 1 = 3$$\n\n**Step 2: Painted length per divider line:**\n- Each cycle consists of one painted line of $3.5\\text{ m}$ followed by a gap of $3.5\\text{ m}$.\n- Length of one full cycle $= 3.5 + 3.5 = 7\\text{ m}$.\n- Over a $350\\text{ m}$ stretch, the number of cycles is:\n  $$\\text{Number of cycles} = \\frac{350\\text{ m}}{7\\text{ m}} = 50$$\n- Painted length per divider line $= 50 \\times 3.5\\text{ m} = 175\\text{ m}$.\n\n**Step 3: Total painted length across all 3 divider lines:**\n$$\\text{Total painted length} = 3 \\times 175\\text{ m} = \\mathbf{525\\text{ m}}$$\n\n**Final Answer:** (c) 525"
    },
    {
      "id": 6,
      "type": "MCQ",
      "marks": 2,
      "negativeMarks": 0.66,
      "question": "An athlete running on a track falls short of the finish line by 10 m when she runs at a constant speed for a given time. If she increases her speed by 20%, she overshoots by 20 m in the same time. What is the length of the track?",
      "options": [
        {